{
  "$schema": "https://json-schema.org/draft/2020-12/schema",
  "$id": "https://fiduciary-wire/schemas/digests-index.schema.json",
  "title": "digests/index.json",
  "description": "Archive: past AI digests (newest first) and weekly M&A recaps.",
  "type": "object",
  "properties": {
    "schema_version": {
      "const": 1
    },
    "generated_at": {
      "type": "string",
      "pattern": "^\\d{4}-\\d{2}-\\d{2}T\\d{2}:\\d{2}:\\d{2}Z$"
    },
    "digests": {
      "type": "array",
      "items": {
        "type": "object",
        "properties": {
          "date": {
            "type": "string",
            "pattern": "^\\d{4}-\\d{2}-\\d{2}$"
          },
          "generated_at": {
            "type": "string",
            "pattern": "^\\d{4}-\\d{2}-\\d{2}T\\d{2}:\\d{2}:\\d{2}Z$"
          },
          "item_count": {
            "type": "integer",
            "minimum": 0
          },
          "path": {
            "type": "string"
          }
        },
        "required": [
          "date",
          "generated_at",
          "item_count",
          "path"
        ],
        "additionalProperties": false
      }
    },
    "weekly": {
      "type": "array",
      "items": {
        "type": "object",
        "properties": {
          "week": {
            "type": "string",
            "pattern": "^\\d{4}-W\\d{2}$"
          },
          "start": {
            "type": "string",
            "pattern": "^\\d{4}-\\d{2}-\\d{2}$"
          },
          "end": {
            "type": "string",
            "pattern": "^\\d{4}-\\d{2}-\\d{2}$"
          },
          "deal_count": {
            "type": "integer",
            "minimum": 0
          },
          "path": {
            "type": "string"
          }
        },
        "required": [
          "week",
          "start",
          "end",
          "deal_count",
          "path"
        ],
        "additionalProperties": false
      }
    }
  },
  "required": [
    "schema_version",
    "generated_at",
    "digests",
    "weekly"
  ],
  "additionalProperties": false
}
